index,used,title,author,publish_time,href,context,search
1,0,"애플 비전 프로, 무엇이 다를까? - 혁신의 애플, 요번에도 무언가를 들고 왔다",크립토노트,Jun 23. 2023,https://brunch.co.kr/@@exo2/40,"살 이유가 없을 것이니깐요. 결국 애플은 비전 프로를 살 이유를 만들어 줄 것 실제로, 최근 애플은 이 비전 OS를 이용하여개발자들이 개발에 힘을 쏟을 수 있도록 환경을 마련하는 것에 힘쓰고 있습니다. 다음 달에는 런던, 뮌헨, 상하이, 싱가포르...",개발자
2,0,월급 없는 월급날~ 생활고에 시달ing - 2023.4.10. 입찰 서류 제출일~ 요구르트&된장찌개..,박기련,Jun 23. 2023,https://brunch.co.kr/@@dNVR/270,"나를 쪼으시고.. 직원들은 제대로 따라와주질 못하고.. 총체적 난국이다. 거기다 디자이너에게 디자인을 가르쳐야 하고..개발자에게 개발을 가르쳐야 하는 상황이 그저 놀라울 따름이다. ""여긴 니들 취미 생활하는 곳이 아니고 월급을 받으려면 최소한...",개발자
3,0,53. 질문의 어려움과 기술,가소로,Jun 23. 2023,https://brunch.co.kr/@@4DRX/175,"새로운 도구를 활용해보는 맥락에서 질문을 던지는건지, 혹은 경쟁이 치열한 시장에서의 성공을 목적으로 하는 컨텐츠개발자의 입장에서 질문을 던지는건지 설명한다면 좀 더 의미있는 논의로 이어질 수 있다. 문제는 이런 질문의 구성 역시 어느 정도로...",개발자
4,0,"Config 2023: 주요 업데이트 리뷰 - 대박이다, 피그마 컨퍼런스 2023.",기획하는 족제비,Jun 23. 2023,https://brunch.co.kr/@@cX6v/38,"아토믹(원자)의 역할을 수행했다. 결국 디자인 토큰이 가지는 키 포인트는 반복되는 디자인 속성을 정의하여 디자이너와개발자가 효율적으로 공유하는 것이며, 디자인이 꾸준히 변동되는 서비스일수록 디자인 토큰의 효과가 커진다. (아래 첨부한 문서를...",개발자
5,0,"하이브리드까지 출시하는 신형 카니발, 이렇게 나올까?",오토버프,Jun 23. 2023,https://brunch.co.kr/@@a950/862,"동일하게 적용될 것으로 보인다. 여기에 현대차그룹의 최신 인포테인먼트 시스템이 적용되어 동영상 스트리밍, 무선소프트웨어업데이트 등의 사양이 추가될 예정이다. 해당 예상도에서는 EV9에 적용된 신규 스티어링 휠이 적용된 것이 특징이다. 기아...",소프트웨어
6,0,"아이오닉 5 N, 전동화 시대의 고성능을 예고하다 - 고성능 N 최초의 전기차인 아이오닉 5 N이 막바지 담금질에 돌입했다.",HMG 저널,Jun 23. 2023,https://brunch.co.kr/@@3hBb/849,"N 브랜드를 통해 고성능을 실현하는 하드웨어 기술을 지속적으로 개발해 왔으며, 아이오닉 브랜드를 통해 전용 전기차 및소프트웨어제어 기술 등을 발전시켜 왔다. 이를 바탕으로 현대차는 두 브랜드의 기술 역량을 집대성해 고성능 전기차라는 새로운...",소프트웨어
7,0,"직접 쓴 출간기획서를 공유합니다 : ) - 우울증 환자가 출간작가가 되기까지, 그 여정의 기록",홍이,Jun 23. 2023,https://brunch.co.kr/@@cI6l/558,어떤 가치를 제공할 수 있을지 적어주시면 좋습니다. * 6. 책의 수명은 몇 년 정도 예상하시나요? 특히 IT 분야는 연관소프트웨어나 프로그램 등의 버전과 일반적인 개정 시기를 알려주세요. * 7. 경쟁 관계이거나 비슷한 책이 있나요? 있다면 제목...,소프트웨어
8,0,시작했습니다. - 이커머스.,언더독,Jun 23. 2023,https://brunch.co.kr/@@edvF/408,"수 있습니다. 틀림없는 사실입니다. 다만, 사업을 영위하는 길보다 시간은 좀 더 들 겁니다. 저는 직장을 다닐 수가 없는소프트웨어를 지닌 사람이 되어버렸습니다. 구조가 이해되고 큰 그림이 보이니, 안락한 곳에 머물겠다는 인간 본성이 싹...",소프트웨어
9,0,"후회 없는 삶을 위해, 지금도 창업에 도전하고 있어요 - 멋사 출신 창업가 인터뷰 시리즈(3) : 조정훈 수료생 인터뷰",멋쟁이사자처럼,1시간전,https://brunch.co.kr/@@2YH6/85,"중에서 5분과 함께하기로 했어요. 함께 하기로 한 분 중에는 멋사 출신 분들도 있었어요. 블록체인 스쿨, 프론트엔드 스쿨,백엔드스쿨 등 총 3분이 함께하게 되었어요. 개발자분들을 많이 모집하셨는데, 비결이 있나요? 개발자분들에게 어떤 부분이...",백엔드
10,0,"노코드를 받아들인 다는 것의 의미 - 노코드 B2B SaaS 마케터의 회고, 다짐 그리고 여정 1",Rooney Kim,7시간전,https://brunch.co.kr/@@2Hvm/356,유입된 햇병아리 비개발자들의 가슴은 더 큰 꿈으로 부풀었다. AI까지 상용화되고 나니 비개발자들은 노코드로 프론트엔드와백엔드까지 개발해 버릴 기세다. 그리고 실제 사례들도 속속 등장하고 있다. 적어도 두 달은 공부해야 하는 서버와 데이터베이스...,백엔드
11,0,재하 창업기 1. 창업의 계기 - 배움의 즐거움 - 재하 창업기,이재하 호박너구리,3시간전,https://brunch.co.kr/@@aPMD/72,"안녕하세요, 초기창업가 이재하입니다! 저는 약 4년간개발자로 일하다가 지난 5월에 B2B SaaS 스타트업 '프릭스'를 공동창업했는데요, 5주 동안 MVP를 완성하여 현재는 CBT를 진행하고 있습니다. 오늘은 어쩌다 제가 창업에 관심을 갖게 되어서개발자를...",개발자
12,0,인공지능은 작가의 꿈을 꾸는가? - AI가 창작자의 권리를 위협하는 기술이라는 주장은 정말 가당할까?,민용준,4시간전,https://brunch.co.kr/@@4Bq/399,써서 하는 행위다. 하지만 판 태블릿을 쓰는 작가와 액정 태블릿을 쓰는 작가의 작업 방식은 동일하지 않을 것이다. 어떤소프트웨어를 쓰는지도 관건이다. 도면화된 공간 이미지를 3D로 제작하는 것을 돕거나 다른 누군가가 만든 이미지를 활용할 수도...,소프트웨어
13,0,"K8 후속 전기차, 한 번 충전으로 800km 달린다?",오토브런치,7시간전,https://brunch.co.kr/@@cwOA/3308,유연하게 적용하는 것을 목표로 한다. GT1에 적용될 eM 플랫폼은 모든 전기 승용차 차급을 만들 수 있는 플랫폼으로 무선소프트웨어업데이트가 기본 사양으로 들어가며 레벨 3 이상의 자율주행 기술도 적용된다. 목적 기반 모빌리티(PBV) 전용으로 개발...,소프트웨어
14,0,가랑이가 찢어지더라도 두 갈래 길을 다 걸어보겠어요 - 프리랜서도 준비하고 이직도 준비하고,심슷,53분전,https://brunch.co.kr/@@ew69/8,"라고 썼다. 여전히 직업을 찾지 못했다. 갑자기 디자인이나 그림을 배울 기본 재능도 없고, 대뜸 책을 낼 수도 없고,코딩은 할 줄 모르고, 영상 편집도.. 아직 일을 받을 능력이 없다. 지금이야 그렇지만 그래도 나의 길을 찾기로 다짐하고 걷기 시작한...",코딩
15,0,글 없이 살 수 있는가? - 매너리즘이 태어나기까지,매너리즘,5시간전,https://brunch.co.kr/@@1dpv/67,"것을 좋아했다. 어릴 때 붓을 잡았다면 나는 그림을 그렸을 것이고, 카메라를 잡았다면 사진이나 영상을 다뤘을 것이다.코딩을 접했다면 게임이나 웹사이트를 만들었을 것이다. 근데 나는 그런 거(다른 예술적인 표현능력) 없다. 그나마 접한 것이 글이다...",코딩
16,0,"이모트, 그거 돈주고 왜 사..?; - 사람들은 이모트를 왜 사용할까?",Danstruct 댄스트럭트,Jun 22. 2023,https://brunch.co.kr/@@70z6/5,"있어 이러한 상황이 가능죠. 이러한 심리로 상대방을 놀리기 위해 사용자들이 이모트를 구매하고, 이용한다는 것을 알게 된 게임개발자들은 어떻게 하면 더 킹받는(짜증나는) 이모트를 만들 수 있을까 고민하며 신규 이모트를 개발하고 있습니다. 2. 동료...",개발자
17,0,나는 가성비 충입니다,수니,Jun 22. 2023,https://brunch.co.kr/@@464e/1234,싶은 것보다는 돈이 더 되는 일을 선택한 거죠. 대학 전공을 선택할 때 취업이 잘 되는 전자계산학과를 선택했고 그래서 IT개발자세상으로 입문했죠. 그렇게 회사에서 일하며 돈을 벌고 모으는 사회생활을 했죠. 그러다가 30대 초반에 재미있는 드라마에...,개발자
18,0,15. 높은 수준의 편집제작 Co-creator(3) - 34. 모바일 서비스 트렌드 : 성공적인 서비스가 갖는 15가지 특징,Rightbrain Lab,Jun 22. 2023,https://brunch.co.kr/@@aD5m/217,"자신만의 콘텐츠를 생산하는 것이 자연스러운 일이 되었다. 코딩 없이 소프트웨어 개발이 가능한 환경인 노코드 개발은,개발자가 아닌 일반인들도 손쉽게 원하는 툴을 간편하게 개발할 수 있기 때문에 개인이 직접 앱 개발을 하는 트렌드가 자리매김하는...",개발자
19,0,영화<소스 코드>-삶의 의미 찾기 - 반복해서 생각하기,윤병옥,Jun 22. 2023,https://brunch.co.kr/@@dIfq/172,"자신을 사랑하는 것을 알고 있다고 말했다며 아버지를 위로한다. 작전이 성공하면 콜터를 죽게 해 주겠다고 약속했던개발자는, 성공한 소스코드 프로그램을 활성화하기 위해 그를 계속 이용하기로 결심한다. 그러나 콜터와 내내 통화했던 여군 장교인...",개발자
20,0,(49) 예상보다 빠른 LTE 확산…양→질적 성장 - 12부. 4세대 이동통신(4G) 시대 개막,김문기,Jun 22. 2023,https://brunch.co.kr/@@Z0g/77,"분사시키고 앱마켓인 T스토어를 오픈했다. KT도 올레마켓을, LG유플러스도 U+스토어를 개장했다. 각각의 이통사는 앱개발자를 지원하는 프로그램을 마련하고 각 장터를 키우기 위한 킬러앱 육성에 힘썼다. 제조사 역시 이 대열에 동참했다. 삼성전자와 LG...",개발자
21,0,Figma Config 2023 - 무엇이 달라지나 - 피그마 컨퍼런스 2023에서 소개된 향후 업데이트 소개,김태길,Jun 22. 2023,https://brunch.co.kr/@@eaQ7/14,"모드와 REST api까지 지원하게 됩니다. 2. 최소/최대 높이 및 너비 그동안 반응형 웹을 작업하며 최소값과 최대값을 항상개발자와 코멘트로 관리하는 어려움이 있었는데, 프레임의 min/max height와 width를 설정할 수 있게 됩니다. 이에 따라 반응형 웹...",개발자
22,1,소프트웨어 장인 :: 2장 애자일,쉴틈없는 하루,Jun 22. 2023,https://brunch.co.kr/@@6h5L/8,"드러난 문제점들을 해결하는 것까지 마쳐야 비로소 서비스가 민첩하게 변화할 수 있다. [테스트 코드의 중요성] 이 특징은개발자한정으로 적용될 것 같은데, 애자일을 실천하기 위해서는 테스트 코드가 더욱 중요한 것 같다. 테스트 코드는 어떤 업무...",개발자
23,0,chatgpt를 사용하여 식물기록장을 개발하는 중기 - 코딩알못이라도 AI만 있다면 개발할 수 있어! 정말?,혜림,Jun 22. 2023,https://brunch.co.kr/@@ct3k/116,"않나? 하는 생각을 하게 되었다. 또 개인적으로 chatgpt나 구글의 bard 같은 생성형 AI 툴을 보면서 늘 궁금했던 점이, 전문개발자없이도 간단한 정도의 디지털 도구를 개발하고 배포할 수 있는가? 였다. 현재 구조로는 전문 지식과 경험을 가진 3-5명이...",개발자
24,0,제품 기획과 브랜드 기획의 차이 - 어떤 기획이 나랑 더 잘 맞을까?,메롱,Jun 22. 2023,https://brunch.co.kr/@@47GT/99,"제품 기획 #협업 #협상 #트렌드 #데이터중심 1. 협업과 협상 제품을 만드는 것은 한 사람이 할 수 없는 일이다. IT 업계라면개발자와 디자이너와 소통을 해야 하고, 소비재를 생산한다면 공장 사장님과 현장 관련자들과 소통이 필수다. 이 과정에서 오류...",개발자
25,1,카카오스타일 앱개발자는 어떻게 일할까 - [이달의 카터뷰] App개발자편,카카오스타일,Jun 22. 2023,https://brunch.co.kr/@@4Zzt/101,"카카오스타일에서 운영하는 앱 서비스를 개선시키고, 효율적인 앱을 만들기 위해 끊임없이 노력하며 도전하고 있는 앱개발자로지와 키키입니다! 지금 두 크루의 이야기를 만나보세요! 안녕하세요 로지, 키키 ! 본격적인 인터뷰 시작 전 무슨 팀에서 어떤...",개발자
26,0,아르마딜로 : 맞춤형 식단 관리의 대중화를 꿈꾸다,스파르타코딩클럽,Jun 22. 2023,https://brunch.co.kr/@@eYeG/30,"팀에서 합류 제안을 받았습니다. 한 팀은 소위 ‘스펙’이 좋은 팀으로 창업 패키지를 몇 번 경험해본 기획자와 능력 있는개발자분으로 이뤄져 있었고, 다른 한 팀이 지금의 멤버였어요. 스펙이 좋은 팀은 하고 싶어하시는 아이템들이 제 관심사 밖의 것...",개발자
27,0,얼렁뚱땅 살고 있습니다.,이방인,Jun 22. 2023,https://brunch.co.kr/@@aWTF/36,"하고 싶은 일이 참 많았다. 어렸을 적에는 발명가, 한창 웹 시장이 뜨거웠을 당시엔 웹디자이너, 현실에 순응한 뒤에는 유능한개발자가 되어 해외 이민을 가고 싶었다가, 이후 허무에 빠져 방황하던 시기엔 돈을 맹신하며 부동산 투자, 경매에 눈을...",개발자
28,0,"자네는 춤을 추게, 난코딩할 테니 - 에스펜 클루게 - 음악가의 신항로 개척",Fellas,Jun 22. 2023,https://brunch.co.kr/@@ewWM/17,그의 초기 작품들로 인물사진을 기반으로 한 생성예술이었습니다. 온라인에서 가져온 사진을 벡터화하여 표현한 것인데코딩에 따라 결과물이 무작위로 달라질 수 있기 때문에 원하는 결과가 나오기까지 여러 차례의테스트과정을 거쳐야 했다고 합니다...,코딩테스트
29,0,Red Ocean Strategy,WJE,Jun 22. 2023,https://brunch.co.kr/@@d5uE/36,"Red ocean 서비스의 Digital Transformation 성격이 큽니다. 우리는 기업들이 채용 시에 사용 해 온 인적성검사를 비롯해,코딩테스트, 과제전형, 언어시험 등 다양한테스트들을 AI를 비롯한 최적화된 기술과 결합한 서비스 이니까요. 다시말해, HR 분야...",코딩테스트
30,0,눈이 나빠도 일할 수 있어요 : Dark Reader,최우주,Jun 22. 2023,https://brunch.co.kr/@@16vm/34,있으며 대학원에서 박사 학위를 받기위해 공부도 하고 있다. 주 업무는 웹과 모바일 인터페이스를 설계하고 front-end(프론트엔드) 개발을 한다. 그리고 데이터 사이언스 관련 일도 하고 있다. 시력이 떨어지기 전 20살 부터 일을 시작하였고 망막질환이...,프론트엔드
31,0,제네시스 '안전띠 불량'으로 27만여대 리콜,오토이슈,Jun 22. 2023,https://brunch.co.kr/@@eV04/305,"확인되어 6월 27일부터 리콜에 들어갑니다. 벤츠 S 580 4MATIC 등 10개 차종, 9,178대는 자동차 안정성제어 장치의소프트웨어오류로 초기 차량 진단 시 펌프 모터 전원공급장치를 고장으로 인식해 자동차 안정성제어 장치가 작동되지 않을 가능성이 확인...",소프트웨어
32,0,[알고러] CX Manager 양성준 프로의 이야기,알고케어,Jun 22. 2023,https://brunch.co.kr/@@8Rbr/13,방향으로 기획이 됐는지 의견을 드리고 기획을 보완하는 식으로 방향성을 잡아가고 있어요. 기획이 완료된 이후에는소프트웨어나 디바이스 파트의 구성원들이 실질적인 개발을 하는 방식으로 서비스를 개선하고 있어요. 얼마 전 시작된 TF인데도 벌써...,소프트웨어
33,0,"""콘셉트와 경계 없는 디자인"" 기아 EV5 미리보기",오토버프,Jun 22. 2023,https://brunch.co.kr/@@a950/861,"재활용 및 친환경 소재가 적용된다. 양산차에는 최신 인포테인먼트 시스템이 탑재된 12.3인치 디스플레이가 적용되며, 무선소프트웨어업데이트 등 최신 사양이 적용된다. 기아 콘셉트 EV5 스위블 시트 또한 EV5 콘셉트카에는 회전 가능한 스위블링 시트...",소프트웨어
34,0,성공을 꿈꾸는 프로젝트 관리자에게 필요한 역량 - 프로젝트를 잘 끝내는데 도움이 되는 다섯 가지 역량,김병호,Jun 22. 2023,https://brunch.co.kr/@@YhJ/192,"시공 프로젝트는 설계를 별도의 프로젝트로 수행하기 때문에 프로젝트 착수시점에 업무범위는 비교적 명확합니다. 반면소프트웨어프로젝트는 요구사항을 상세하게 정의하지 않고 분석, 설계, 개발을 하나의 프로젝트로 통합하여 수행하는 경우가...",소프트웨어
35,0,"생성AI, 유통 커머스 리테일 산업 판도 바꾼다 - ● 생성AI, 다시 한 번 소비자 쇼핑의 혁신을 이끌까",굳찌,Jun 22. 2023,https://brunch.co.kr/@@6vJy/119,"추가 생산하게 될 것이다. 이는 모든 인공 지능의 영향력을 15~40%까지 증가시킬 수 있는 수준이다. 현재 업무에 사용되는소프트웨어에 생성 AI를 내장하는 것까지 포함하면 이 추정치는 약 두 배가 될 것으로 예상하고 있다. 산업 별로는 은행, 하이테크...",소프트웨어
36,0,11. 폼에서 에러 표시 10가지 디자인 가이드라인 - [2.폼 앤 위자드],Potatohands,Jun 22. 2023,https://brunch.co.kr/@@2aZa/268,어떤일이 벌어진지 합리적인 시간안에 적절한 피드백을 줌으로 알려줘야한다. 실수하는 것은 인간이고 사람들은소프트웨어를 사용할때 실수 할것이다. 오류의 흐름은 사용자가 반드시 에러를 고치기 위해 겪어야하는 단계이다. 사려깊은 에러 흐름은...,소프트웨어
37,0,월 구독료 150만원 - 신약의 새로운 마케팅 포인트,BH,Jun 22. 2023,https://brunch.co.kr/@@8156/111,만드는 것이다. 정기 구독은 잡지에만 있는 건지 알았는데 유튜브가 구독하라고 하더니 어느 순간 MS오피스까지도소프트웨어와 클라우드시스템을 구독제로 바꾸었다. 뭐니 뭐니해도 매달 월세들어오는 건물주가 최고라더니 이젠 모든 실물과 가상 서비스...,소프트웨어
38,0,세상에 나쁜 방법론은 없다 – 데일리샷 개선 스토리,Mobiinside,Jun 22. 2023,https://brunch.co.kr/@@zIH/5335,"완벽한 계획을 갖춘채 개발하는 절차가 매우 중요했기 떄문에 워터폴 방식의 방법이 적합했으나, 90년대가 되면서소프트웨어분야의 대중화로 시장에 대한 니즈가 다양해지고 비즈니스의 사이클이 짧아지면서 트렌드의 속도도 매우 빨라졌다. 이는...",소프트웨어
39,0,DX 뉴스피드 (23.06.22) - 매일 아침 받아보는 디지털 트랜스포메이션 뉴스,이노핏파트너스 innoFIT Partners,Jun 22. 2023,https://brunch.co.kr/@@9xP4/257,"기술은 사람들이 좋아할만한 문화 콘텐츠를 더 쉽고 빠르게 만드는 데 유용하게 활용될 수 있을 전망이다. 2. [Business] KT,코딩교육 플랫폼에 AI 튜터 도입 KT는 인공지능(AI)코딩교육 플랫폼 'AI 코디니'에 대화형 블록코딩서비스 'AI 튜터'를...",코딩
40,0,cOlOr - 자신만의 색깔 찾기,올리브트리,Jun 22. 2023,https://brunch.co.kr/@@8zkf/6,"나는 진짜 나를 만나게 되었고 나의 정체성에 대해 생각을 하게 되었다. 여러 분야의 책들을 통해 프레임을 깨기 시작했고,코딩&아트&영어 강사로 많은 아이들을 만나며 교육하면서 내가 이 땅에서 존재해야할 이유, 무엇을 해야할지 등 점점 내 삶을...",코딩
41,0,"나도 이런 경험을 해보는구나 - 브런치 글 게재, 뉴스 기사",Spark,Jun 22. 2023,https://brunch.co.kr/@@43qD/52,생각이 든다. 그냥 갑자기 생각해 보니 이런 기회들이 나한테 어떻게 왔을까 일련의 과정들이 신기하긴 하다. [스파르타코딩클럽 브런치 글 게재] https://brunch.co.kr/@sparta/30 [한국경제 기사] 구글에 검색해 보니 여러 신문사에 내신 것 같다만...,코딩
42,0,2023.06.19.월. - 2023.06.21.수.,내가 사는 세상,Jun 22. 2023,https://brunch.co.kr/@@4rqc/522,화폐금융론 - 화폐금융론 기말고사 - 비주류의 경제학 - 비주류의 경제학 - 경제변동성장론 - 계량2 var - 계량2 var matlab코딩2023.06.20.화. - 비주류의 경제학 ch13 - 비주류의 경제학 ch14 15 - 경제변동성장론 - 경제변동 성장론 - 비주류의...,코딩
43,0,ChatGPT 장애인에게는 얼마나 도움이 될까?,최우주,Jun 22. 2023,https://brunch.co.kr/@@16vm/32,진짜 AI를 ChatGPT를 통해 경험하고 말았다. 비록 거짓된 정보를 말하는 경우도 있지만 이미 잘알려진 정상과학의 분야나코딩능력은 알파고가 이세돌 9단을 이긴 이후의 상황처럼 '넘사벽'이 되었다. 인류는 앞다퉈 이 Product의 활용을 모색했다. 자신의...,코딩
44,0,요즘 하는 생각들 - 2023년 상반기를 마치며,재민,Jun 22. 2023,https://brunch.co.kr/@@9sKm/8,"6개나 가져갔음에도 4전공 2교양이었던 지난 학기보다 성적이 더 잘 나올 수밖에 없을 만큼 공부했고, 컴퓨터 관련 지식 및코딩실력도 제법 늘었고, 읽고 싶던 책도 제법 읽었으며 블로그 포스팅도 계획한 대로 다 썼다. 성과 자체는 나쁘지 않았다고 볼...",코딩
45,0,그 재능이 샘이나,빛담,Jun 21. 2023,https://brunch.co.kr/@@dcPO/181,"알려주신 '개발자 형님'이 평소와는 다른 이야기를 하고 계셨다. 개발자 형 :""혹시, 궁금한 거 없어요? 프런트엔드도 좋고백엔드도 좋고"" A : ""아 저는 며칠 전에 물어봤던 Flex Display 같은 거 잘 모르겠더라고요"" B : ""오, 우리 구루님 강의면 무조건...",백엔드
46,0,"독일 물류 서밋에서 만난 '물류의 미래' 스타트업 셋 - 건축자재 주문 앱, 웨어러블 스캐너, 유휴공간 거래 플랫폼, 배송기사 위",일이삼팩토리,Jun 21. 2023,https://brunch.co.kr/@@4oD0/46,35%나 줄였다. 손등에 차는 웨어러블 스캐너와 관리 소프트웨어를 개발하는 스타트업 님스타. 사진=nimmsta.de 님스타는개발자출신의 안드레아스(Andreas Funkenhauser)와 플로리안 룰란트(Florian Ruhland)가 2019년 뮌헨에서 설립했다. 물류센터 직원...,개발자
47,0,"무계획 여행의 미묘한 실패, 여름의 삿포로 - 퇴사 전 홋카이도 여행",꿈작가,Jun 21. 2023,https://brunch.co.kr/@@rdy/43,중요하다는 생각이 들었다. 필요한 정보에는 어떤 것들이 있을까? 간단하게 생각해도 현재 싱가포르에서 나 정도의 연차의개발자가 취직하는 경우가 얼마나 있는지? 내가 진행할 프로젝트가 어떤 분야의 취직에 도움이 될 수 있는지? 내가 가게 될 도시는...,개발자
48,0,"랜덤 채팅의 그녀 윤성아, 원피스의 골드로저 - 포화된 데이팅 앱 플랫폼 시장에서 경쟁력 있는 무기는 차별화된 마케팅",박중현,Jun 21. 2023,https://brunch.co.kr/@@8fzd/114,과도한 개인정보를 수집했다면 정보보호에 대한 엄격한 기술 조치가 따라야 하지만 현실은 그렇지 않았다. 2021년 9월경 한 IT개발자가 회원들의 개인정보를 빼내 이용자들을 협박하고 운영사에 수십억 원 상당의 가상화폐를 요구하면서 피해는 가입자들...,개발자
49,0,대체불가능한 마케터로 성장하는 5가지 필살기 - 불확실한 미래에 살아남기 위한 마케터의 5가지 역량,타비,Jun 21. 2023,https://brunch.co.kr/@@7aZb/32,"마케팅 영역은 다양한 이해관계자가 존재합니다. 광고를 운영하는 것만 해도 MD, 퍼포먼스 마케터, 콘텐츠 마케터, 디자이너,개발자, 재무 담당자 등 다양한 사람들의 이해관계가 얽혀있죠. 일정 규모 이상의 회사 또는 예산이 주어지면 혼자 모든 걸 할...",개발자
50,0,그래서 메타버스가 뭐라고요? - 인공지능이 메타버스와 만났을 때,mizanarai,Jun 21. 2023,https://brunch.co.kr/@@7o8l/12,"정리한 예시이니 한번 보시죠. 소비자가 다양한 앱이나 콘텐츠, 기능을 만날 수 있는 플랫폼. (os, 하드웨어 등)개발자가 여러 가지 기능들을 사용할 수 있도록 라이브러리를 제공하는 플랫폼. (sdk 등) 소비자와 소비자를 직간접적으로 이어주는 플랫폼...",개발자
51,0,작은 일을 하더라도 '존재감' 드러내기 - [협업꿀팁],Atlas,Jun 21. 2023,https://brunch.co.kr/@@eXMq/10,"사항을 거절할 때는 합당한 근거를 준비해서 전달해 보세요 근거 없는 대안과 거절은 상대방 역시 납득하기 어렵습니다. ✅개발자, 기획자, 디자이너의 입장은 다를 수 있다는 것을 명심하세요. 우리 모두 각자의 전문성을 가지고 있기 때문에 모든 업무에...",개발자
52,0,"문과 취업 전략, 채용담당자들이 말하는 핵심 역량은? - 커리어 인사이트",스펙터 Specter,Jun 21. 2023,https://brunch.co.kr/@@eddU/232,합니다. 이렇게 청년 취업률이 낮아지고 있다면 문과 취업도 상황이 녹록지 않겠죠. 특히 지난 2020년과 2022년 사이개발자로 진로를 바꾼 문과생들은 최근 기업들이 경력자와 고학력 전공자를 우대하는 상황이어서 취업이 쉽지 않다고 합니다. 그러면...,개발자
