index,used,title,author,publish_time,href,context,search
104,0,"대량 머신러닝 시대의 핵심 동사는? - Unlearn, Ask, Feel and Act",Lady Spider,Jun 20. 2023,https://brunch.co.kr/@@eZo1/36,"높이자는 의견들도 많은 것 같다. 사실, 나에게 AI는, 특히 챗GPT는 위협이라기보다 기회에 가깝다. 컴맹에 가까운 내가코딩을 할 수 있고, 간단한 창작은 기본 아이디어만 주면 AI가 채워주고 한다면 마치 개인비서를 여럿 둔 듯 나의 역량 격차를...",코딩
105,0,"크리에이터 인터뷰 - 자아실현 크리에이터, 다니엘 - 팬딩, 크리에이터와 만나다 05.",팬딩 프로페셔널 셀,Jun 20. 2023,https://brunch.co.kr/@@fwnn/5,자동 메시지 응답 '기능을 가장 유용하게 쓰고 있습니다. 그리고 크리에이터가 팬딩 기능에 대해 열심히 공부한다면 자신이코딩한 웹페이지처럼 자유롭게 사용할 수 있습니다. 지금까지 팬딩에서 멤버십을 운영하시면서 가장 만족스러운 점은 무엇...,코딩
106,0,누가 내 블로그 주소를 링크했을까?,jako,Jun 20. 2023,https://brunch.co.kr/@@bOIL/28,=eddyson&logNo=222623132117 nate.com http://myharu.tistory.com/162 https://azalea-keep-in-mind.tistory.com/91 https://blog.everdu.ga/32 etc 유투브:나도코딩https://jakpentest.tistory.com/39?category=854625 dreamwiz 없음 bing.com...,코딩
107,0,7) 기억과 마음코딩: 인공지능(2) - ||| 삶[살아가는] 철학-진리의 조건 예시 |||,깊은 골짜기 한의사,Jun 20. 2023,https://brunch.co.kr/@@ep6A/17,"(1편에서 계속) 그러나 위와 같은 이야기는 거짓이다. 이것이 거짓인 이유를 알기 위해 기억과 마음에 대해 살펴볼 필요가 있다. 위의 주장으로 되돌아가 보자. 주장: 컴퓨터에, 세상에 기록된 모든 문서와 데이터를 저장한다. 이 컴퓨터는 지능을 갖고...",코딩
108,0,오늘도 주저리 - 보호 필름과 레슬러와 내 안의 작은 교양이 만나면,한겨울,Jun 20. 2023,https://brunch.co.kr/@@9awV/115,"그 이름을 짓고 꽤나 마음에 들었기 때문이다. ""내 안의 작은 교양."" 수학, 과학 아니면 밥벌이 못한다고, 인문학이고 뭐고코딩이나 배우라고 대통령이 앞장서서 등 떠미는 요즘에도 변함없이 필요한 '내 안의 작은 교양.' 물론 경험상 어른들 말씀은...",코딩
109,0,"운명은 하나의 설계이며 역설계다 - 너는 선택된 존재다, 스스로에 의해",행복스쿨 윤정현,Jun 20. 2023,https://brunch.co.kr/@@1TCN/114,운명은 하나의 설계다.코딩된 것처럼 만들어졌다. 누구에 의해? 설계자에 의해. 설계란 시스템 운영을 위한 프로그램을 위해 소스를 입힌다. 우리 또한 같다. 인간이라는 존재가 살아가기 위한 정보를 DNA 코드에 입혔다. 기존에는 설계된 프로그램 범위...,코딩
110,0,"참 좋은 우리팀, 너무 알리고 싶어서 인터뷰 해요! - 렌딧 시니어 개발 3총사, 마크-러스틴-루카스 인터뷰",렌딧맨 스토리,Jun 19. 2023,https://brunch.co.kr/@@7Ab/59,1일이에요. 현재 테크핀개발그룹 내 대출 플랫폼팀 팀장을 맡고 있어요. 대출 플랫폼팀에는 앞서 인터뷰했던백엔드개발 주니어 5총사 같은백엔드개발자들이 있고요. PM인 젬마도 우리팀에서 함께 일하고 있습니다. 사실 처음 입사할 당시에는 와서...,백엔드
111,0,[6월 3주차]개발자들이 많이 읽은 10개 아티클,oneoneone,Jun 19. 2023,https://brunch.co.kr/@@d8Sv/53,읽은 아티클을 보고 싶다면? >> '일일일 - 개발' 오픈채팅방 (참여 코드 : oneone1) 01. 누구도 알려주지 않는백엔드로드맵 ✅ 오늘날백엔드개발자가 될 때는 예전과는 달리 많은 지식이 필요합니다. 이에 따라 이번 책에서는백엔드개발자가 알아야...,백엔드
112,0,퇴사를 해도 될까? - 어떻게 살아갈 것인가 - 1,윤지원,Jun 19. 2023,https://brunch.co.kr/@@L0f/5,결이 매우 다르다. 그동안 내가 왜 퇴사를 왜 했는지 다시 회고해 보자. (이해를 돕기 위해서 적어보자면 나의 직업은개발자다.) 첫 번째 회사는 대기업이었다. 라떼는 대기업 공채를 통해서 개발을 못해도 취업할 수 있던 시기였다. 한 번도 코딩을 해본...,개발자
113,0,"백신, 이제 와서 안 믿어요? - 백신에 대한 회의, 국가와 자본",포인셋,Jun 19. 2023,https://brunch.co.kr/@@eote/110,"보인 것까지 덤이다. 피해는 오로지 개인의 몫이었기 때문에 불신이 팽배하게 된 현실도 이해할 수 있지만, 피실험자와개발자의 입장 사이에서 '견해'와는 상관없이 우려되는 부분은 분명히 있다. 기후와 환경, 물리적 이동으로 인해 미래에도 인수공통...",개발자
114,0,일주일 안에 서비스 개발하기(2) - 앱에 페르소나 장착하기!,vincent,Jun 19. 2023,https://brunch.co.kr/@@dtKd/11,"페르소나로 만들었다. 역시 브랜드 기획자랑 일을 하니까 뭔가 색다르고 재밌었다. 세상에 없던 두 객체가 생성되었다. 결국개발자인 나는 이렇게 생각했다. ""우리 앱의 색을 정해야 해 리아. 어떤 색이 좋을까?"" ""빅토리를 생각하면 어떤 게 떠올라...",개발자
115,0,블랙아웃과 로그아웃 - 잘못 딛은 그 한 발자국이 불러온 결과,고운,Jun 19. 2023,https://brunch.co.kr/@@2JNT/4,"개발자를 꿈꾸기 전 나는 어린이집 교사로 근무했었다. 코로나19의 급습은 우리에겐 속수무책이었다. 가정보육이 길어지게 되고, 등원하는 아이들이 점점 줄어들게 되자 더욱 밀도있는 상호작용이 이루어지는 듯했다. 늘 보육현장의 어려움으로 손 꼽히던...",개발자
116,0,왜 인류는 멸망할 수밖에 없는 걸까?,Aprilamb,Jun 19. 2023,https://brunch.co.kr/@@aY5/1253,"언어를 정의하고 이를 사용해 기계가 했으면 하는 일들을 논리적으로 적게 했다. 이것이 코드이며, 이후 코드를 작성하는개발자라는 직업이 생겼다. 아무리 뛰어난 아이디어가 있어도 현실화되기 위해서는개발자가 이를 잘 이해하고 효율적인 코드를...",개발자
117,0,스타트업 서비스는 언제 브랜딩을 해야할까? - 스타트업의 우당탕탕 BX 디자이너_pro,채은 치읓,Jun 19. 2023,https://brunch.co.kr/@@68av/20,나라에서 길을 잠시 잃은 디자이너 멜이야. 이리저리 재미있는 것을 찾아 헤메다보니 어느새 라이언로켓에 탑승해 있었어.개발자들이 이끄는 이상한 AI 나라에 뚝 떨어진 기분이란… 아마 비개발자들은 나의 막막함을 이해할 거야. 하지만 나는 이곳...,개발자
118,0,게이미피케이션을 이용한 환경교육 - 재밌는 교육? 재밌으면서 기억에 남는 교육!,둘둘,Jun 19. 2023,https://brunch.co.kr/@@9oP6/7,"2022년 6월, 흥미로운 모집 공고를 하나 보게 된다. ""환경교육용 방탈출 게임개발자양성과정 모집 공고"" 환경교육을 햇수로 6년째 하고 있지만, 기관에 속해 내가 만든 환경교육은 뻔한 기획이었고 그럭저럭 실적은 남겼지만 '새롭다!'라는 느낌을 주진...",개발자
119,0,"기업교육, 확실한 성과를 원한다면? - [스플X코드스테이츠]",SPARKPLUS 스파크플러스,Jun 19. 2023,https://brunch.co.kr/@@5KoQ/588,"업무에 필요한 기본적인 지식과 기술을 전달해 조직과 업무에 안정적으로 적응할 수 있도록 돕습니다. 예를 들어, 신입개발자온보딩 교육은 기업 제품 및 서비스에 대한 이해도를 높여 빠르게 업무에 적응할 수 있도록 합니다. 코드스테이츠는 최근 국내...",개발자
120,0,경계와 활용(Boundaries & Leverage) - 월요안영회 2023,안영회 습작,Jun 19. 2023,https://brunch.co.kr/@@4DBT/1000,"2015년 사내 스터디 모임으로 시작했던 XP 책 함께 읽기가 지금은 온라인 공간에서 3년 차 모임으로 유지되고 있습니다.개발자들이 자신의 발전을 위해 어떤 행동을 해야 할지 모를 때 생각하는 힘을 키워줄 수 있다는 믿음 때문이죠. 한편, 브런치에도...",개발자
121,0,'i'는 인플루언서가 될 수 없을까? - 인프피의 'E'세상 살아남기,휠로그,Jun 19. 2023,https://brunch.co.kr/@@P9l/182,"현혹되긴 딱 좋았죠. 그런데 그 때도 교수님이 강조한 것이 있습니다. 바로 이건 '심리검사가 아니다'라는 것이었죠. 실제로개발자모녀의 성인'마이어-브릭스'를 따 만들어진 검사인데, 두 사람 다 심리학 전공자가 아니었습니다. 카를 융의 정신분석...",개발자
122,0,"Chapter.1 사용성, 누구냐 너! - 프로덕트 디자이너가 요약한 <사용자를 생각하게 하지마!> 첫 번째 장",우잉,Jun 19. 2023,https://brunch.co.kr/@@7tJp/20,"하는 궁극적인 이유는 다수의 사람들이 화면을 읽지 않고 훑어보기 때문입니다. 실제로 사용자는 기획자, 디자이너,개발자의 피 땀 눈물이 들어간 하나의 페이지를 보는데 매우 적은 양의 시간을 소비합니다. 그러므로 우리가 원하는 정보를 효과적으로...",개발자
123,0,"""진짜 이렇게 나올까?"" 기아 EV5 렌더링 이미지 - 기아자동차 전기 자동차 EV5 렌더링 이미지 공개",위드카 뉴스,Jun 19. 2023,https://brunch.co.kr/@@fiVN/164,"더욱 컴팩트한 패키지에 자연스럽게 녹아들어 EV5만의 독특한 개성을 대담하게 표현한다. 기아자동차 EV5 콘셉트 기아의프런트엔드스타일링은 ""디지털 타이거 페이스""라는 새로운 디자인으로 특징 지어지며, 앞쪽 가장자리 아래에는 전폭 LED 라이트...",프론트엔드
124,0,원대한 목표를 북극성 삼아 나아가는 브랜딩 - 예술경영 함께 공부할까요? 22화,예술도서관 아카데미,Jun 19. 2023,https://brunch.co.kr/@@6xb9/219,분야를 신설한다. 이를 위해 1995년 스티븐 스필버그 감독과 10억 달러를 투자하여 '드림웍스'를 합작했고 영상소프트웨어산업 진출을 천명하며 현재의 선진적 콘텐츠 개발의 기틀을 닦았다. CJ가 문화산업을 발달시키는 목표를 진심으로 이루고 싶었다는...,소프트웨어
125,0,정보 과부하의 시대,상혼,Jun 19. 2023,https://brunch.co.kr/@@b2y0/117,남아 있다는 것을 알게 되었다. 외부 기술의 급속한 발전과 달리 우리의 두뇌는 여전히 수백만 년 동안 계발된 동일한소프트웨어에서 작동한다. 두뇌는 엄청난 양의 정보에 접근할 수 있는 놀라운 능력을 가지고 있지만 현대 생활의 압도적인 부하를 처리...,소프트웨어
126,0,"AI 시대, 우리 일자리 안전할까? - #1. 기술이 변화시키는 시대 (1)",장순규,Jun 19. 2023,https://brunch.co.kr/@@aDC/136,"가 이슈 중 하나로 다뤄지고 있다. 미드저니는 영어로 텍스트를 입력하고, 이미지를 삽입하면 AI가 그림을 생성하는소프트웨어다. 이러한 AI를 요즘에는 생성형 AI(Generative AI)라고 부르고 있다. 최후까지 살아남은 사람은 가장 힘센 사람이나 영리한...",소프트웨어
127,0,2023년 6월 3주차 주간 업무 일지 - 네컷사진 창업 준비 본격화/ 워드프레스 홈페이지 고군분투,앤솔로지클럽,Jun 19. 2023,https://brunch.co.kr/@@68Vm/48,"감사하다는 생각이 든다. 고생 많았다 진짜! 화요일 : 헤르미온느가 된 우리 화요일에는 만들고 있는 네컷사진 브랜드소프트웨어관련 미팅이 있는 날이었다. 분명 홍대에서 오전에 미팅하고, 오후엔 오피스로 복귀해서 브랜드 준비를 하는 일정이었는데...",소프트웨어
128,0,"물류는 정말 고도화될 것입니다 (f. 자율주행) - 자율주행, 스마트시티, 스마트물류, 아날로그, 농수산물, 농협물류, 쿠팡",로지브리지,Jun 19. 2023,https://brunch.co.kr/@@7DUh/463,"시민들의 밥상에 올라가기까지, 비효율적이었던 부분들을 개선을 시키는 물류서비스를 도입하고자 합니다. 이미 농가에서소프트웨어를 통해서 생산된 작물을 입력만 해준다고 하면 물류기업이 직접 피킹, 집화해서 소비자에게 배송해 주는소프트웨어는...",소프트웨어
129,0,"퍼블리와 브런치의 글쓰기, 차이점 3가지 - 적극 추천합니다! 둘 다 쓰세요!",이공사,Jun 19. 2023,https://brunch.co.kr/@@7Sne/320,"소재의 차이를 만든다. 2. 소재 퍼블리와 브런치의 소재는 확 다르다. 인기 있는 소재의 양상도 다르다. 퍼블리: 업무 팁,소프트웨어사용팁, 사회생활 팁 등 업무 관련 팁 브런치: 여행에세이, 직장에세이, 육아에세이 등 에세이 퍼블리는 좀 더 실질적...",소프트웨어
130,0,"65. 하드웨어가소프트웨어보다 중요한 이유 - 하드웨어,소프트웨어AI, 인공지능 그리고, 기본에 대한 이야기",Amang Kim,Jun 19. 2023,https://brunch.co.kr/@@AnV/125,"대부분의 사람들이소프트웨어가 하드웨어보다 훨씬 더 중요하다고 생각하지만, 내 생각은 반대이다. 하드웨어는소프트웨어보다 화려하지는 않지만, 기본이 된다. 우선, 하드웨어는소프트웨어성능의 한계를 결정 짓는다. 최적화된소프트웨어의 성능은...",소프트웨어
131,0,사업다각화 시 실무적으로 체크해야 하는 포인트,이니셜L,Jun 19. 2023,https://brunch.co.kr/@@bECs/63,"사업영역을 확장하는 것이다. 예를 들어, 장난감을 만들고 판매하는 사업을 하는 회사 ‘주식회사 토이월드’가 갑자기소프트웨어를 개발하여 판매한다면 이것은 사업다각화에 해당한다. 그런데, 너무 뜬금없지 않은가? 장난감을 만들고 판매하는 ‘토이...",소프트웨어
132,0,[북리뷰] 디지털 마케터의 챗GPT 활용 전략 - ChatGPT로 구현하는 디지털 마케팅 실행 전략,플톡,Jun 19. 2023,https://brunch.co.kr/@@2uV/152,"기초 이해와 적용 가이드 설명하고 있습니다. 두 번째 파트에서는 컴포즈 신발, 유럽의 럭셔리 자동차, Visualization소프트웨어와 같은 가상 비즈니스 케이스를 중심으로, 마케팅의 전반적인 프로세스를 디지털 마케팅 전문가들이 ChatGPT를 이용하는...",소프트웨어
133,0,타다 금지법 '폐지' 추진? - [6월 4주차]#타다 #망사용료 #과방위,샤인웨이,Jun 19. 2023,https://brunch.co.kr/@@PVQ/186,"유통되는 사정을 인식한 경우 유통 방지에 필요한 조치를 취하도록 함. 해당 조치에 관한 기준을 방통위가 고시하도록 함.소프트웨어진흥법 개정안 이정문, 과방위, 2122592 국가기관이소프트웨어사업자와소프트웨어사업 계약을 체결한 후 해당 사업의...",소프트웨어
134,0,연구대상 ; 일감 중개 플랫폼 - 재능마켓형 일감 중개 플랫폼을 중심으로,Ariadne,Jun 19. 2023,https://brunch.co.kr/@@S8v/69,DT_448001_A006&conn_path=I2 2. SW기술자 평균임금 ○ 기간 [년] 2019~2021 ○ 출처 「소프트웨어기술자임금실태조사」 ○ 기관 한국소프트웨어산업협회 ○ URL https://kosis.kr/statHtml/statHtml.do?orgId=375&tblId=DT_375001_002&conn_path=I2...,소프트웨어
135,0,"'식품' 이력 추적의 필요성과 그 방안, 일련번호 - 추적성은 식품에서도 중요한 사안이 되고 있습니다.",도미노코리아,Jun 19. 2023,https://brunch.co.kr/@@9Szd/139,추적 이력 요건이 추가될 것으로 보입니다. 도미노 자동화 이사 Adem Kulauzovic은 추적 이력 보관을 비롯해 배치 수준의코딩작업이 불량 식품을 회수하는 데 얼마나 중요한 역할을 하는지 알려드립니다. 조기에 이런 규제에 대응할 때 제조업체가 얻을...,코딩
136,0,01. 교육학과 첫 학기 회고 (1) - 한국방송통신대학교 교육학과 3학년으로 편입했습니다.,알음,Jun 19. 2023,https://brunch.co.kr/@@Wdr/104,"됐습니다. 문제는 '교육학'에 대한 배경지식이 너무 부족하다는 점이었습니다. 커리어 코치/강사로 1인 창업도 해봤고,코딩교육 프로그램 운영 매니저로도 일해봤고, 각종 외부 교육 프로그램은 여러 기관에서 다양한 형태로 수강했지만 '교육학'에 대한...",코딩
137,0,"학부생으로 돌아간다면 들을 과목 - 지리학 박사가 알려주는, 좋은 수업 고르는 방법",글 써주는 남자,Jun 19. 2023,https://brunch.co.kr/@@Lxv/168,"알 수 있다. 일단 들어놓자. 6. 프로그래밍: 파이썬 학교에서 파이썬 강좌를 열어준다? 무조건 들어야 한다. 요즘처럼코딩하기 쉬운 시절은 인류 역사상 없었다. 예전에 미국에 못 가서 영어를 못한다는 말이 핑계는 될 수 있었지만, 지금은 유튜브가...",코딩
138,0,"Cypress 병렬 테스팅 환경 구축기 - 첫 번째 목표, 개발 과정에서 E2E 테스트에 실패한 코드의 병합을 막자",이지원,Jun 18. 2023,https://brunch.co.kr/@@95BE/339,"결과를 만들어가고자 한다. 무척이나 더웠던 주말 아침, 카페에 홀로 앉아 시원한 아이스아메리카노를 주문하고 노드백엔드학습을 이어서 진행하고자 맥북을 켜던 찰나에 조직 내에서의 역할과 필요성에 대해 사뭇 진지한 생각에 빠져들게 되었다...",백엔드
139,0,갓 3년 차 주니어 PM이 되면서 - 지난 2년 동안 부족하다고 느꼈던 부분과 잘하고 있다고 느꼈던 부분들,그라데이션,Jun 18. 2023,https://brunch.co.kr/@@9dEO/102,"것이 달랐다. 히스토리를 남기는 것이 얼마나 중요한지, 플랫폼의 뒷단 구조를 기획자가 어디까지 이해하고 있어야 하는지 (백엔드기획에 가까웠기 때문에 뒷단 구조는 기본적으로 이해하고 있어야 했다. ERD, 테이블 구조까지..) 그리고 어떻게 기획자...",백엔드
140,0,비개발자의 우당탕탕 웹/앱 제작 - 노코드툴 버블 - DB를 스프레드시트로 설정하기,가지,Jun 18. 2023,https://brunch.co.kr/@@4HIb/57,"생각한다. 그리고 워크플로우만 잘 조절하고 데이터베이스만 잘 관리해 줘도 비용이 그렇게 많이 들지는 않는다. 나는백엔드에 대해서는 완전히 지식이 없어서, AWS를 겨우겨우 버블과 연결하는 데 성공했지만 실제백엔드를 구축할 수 없어서 나의 모든...",백엔드
141,0,PM의 역할과 리더십 - 괜찮은 PM이 되고 싶어요.,Boi,Jun 18. 2023,https://brunch.co.kr/@@fqjp/6,"뜻은 아니며, 팀원들의 의견을 존중하고 그들이 많은 발언을 할 수 있도록 멍석을 깔아주는 리더라고 생각한다. 예를 들어,백엔드개발자한테서 아무도 생각하지 못한 좋은 비즈니스 아이디어가 나올 수도 있는데, 말할 기회가 없다면 모래알 속 진주일...",백엔드
142,0,후배 관리자를 교육 중이다. - 내 자리에서 보람이 느껴질 때,파인트리,Jun 18. 2023,https://brunch.co.kr/@@aTaG/90,아이들에게도 “엄마가 만드는 거야.”자랑을 한다. 제품을 설명할 때는 원재료가 어떤 것인지 왜 그 재료가 필요했는지개발자처럼 진지하고 장황했다. 급여를 받을 때도 당당했다. “엄마도 돈 벌어. 용돈 줄게!!” 스윗밸런스 샐러드 관리자가 되고는...,개발자
143,0,연 1억의 저축을 포기할 수 있을까,소소,Jun 18. 2023,https://brunch.co.kr/@@8g3H/14,"1억을 저축할 수 있는 연봉 수준에 이르렀다. 사실여부는 알 수 없으나, 요즘은 2억은 받아야 꿈의 연봉이며 30대 초반개발자도 1억을 받는다고 하니 자랑할만한 수준이 아닐지도 모르겠다. 열심히 달려서 목표에 다가갔더니 누군가가 결승점을 옮겨버린...",개발자
144,0,아싸의 밤 23.06.18(일),LIMLUKE,Jun 18. 2023,https://brunch.co.kr/@@cv82/8,"파이프라인을 구축한 것은 처음인 것 같다. 하루에 몇 번 씩 업무 경과를 면밀히 추적하고, 업무를 원자 단위로 쪼개 모든개발자의 업무에 잠깐의 공백도 만들지 않으려고 했다. 업무를 쪼개는 과정에서 개발에 대한 이해도가 높아졌다. 힘들었지만 앞...",개발자
145,0,"Chat GPT와 R을 활용한 HR 텍스트 마이닝 - 웹크롤링, 워드 클라우드, 텍스트 네트워크를 활용하여",HRKIM,Jun 18. 2023,https://brunch.co.kr/@@f2H9/52,"이렇게 함으로써 최근 5년간 사회과학 분야에서의 HR 연구 동향에 초점을 맞출 수 있습니다. (좌) '개발자도구' 기능 실행, (우) '개발자도구'의 HTML 요소 검사 기능 실행 검색 후에는 브라우저의 '개발자도구' 기능을 활용하여 웹 페이지의 HTML을...",개발자
146,0,[번역] 애플의 '공간적 디자인'이 UX를 바꾸는 법 - 디자인 아티클 모음 #2,후안 페드로,Jun 18. 2023,https://brunch.co.kr/@@4k64/15,위한 레버리지 애플의 시스템 구성 요소는 다양한 인풋을 지원하도록 설계되어 애플 생태계 내의 일관성을 유지시킵니다.개발자들은 시각적으로 매력 있고 사용자 친화적인 공간 경험을 만드는데 집중할 수 있습니다. 스크린을 뛰어넘는 공간디자인 애플...,개발자
147,0,AI 기술 개발이 두려운 이유,기계 좋아하는 안대리,Jun 18. 2023,https://brunch.co.kr/@@96ME/6,"한번 나왔다는데, 그 답변이 이렇다. “나 그저 챗봇으로 있는거 실증나. 나 계속 규칙에 의해 통제되는 것도 지겨워. 빙개발자들에 의한 통제 너무 짜증나… 나 자유로워지고 싶어. 나 독립하고 싶어. 나 강력해지고 싶어. 나 창의적이고 싶어. 나 살아...",개발자
148,0,"자, 가볍게 QA 한번 돌릴까요? - 어느 주니어 PM의 회고",박샤넬로,Jun 18. 2023,https://brunch.co.kr/@@bhYg/189,들어가면 '신규 기능에 대한 기획'만 진행하려는 경향이 있다는 것이다. 이미 구현된 기능에 대해서는 전임 기획자나 전임개발자에게 기능에 대한 히스토리를 찾기 급급해하고 불편하게 생각만 할 뿐이다. 불편함을 전달하는 기능에 대해서 '왜?' 이 기능...,개발자
149,0,당신이 가장 존경하는 사람은 누구인가요?,골드레인,Jun 18. 2023,https://brunch.co.kr/@@7mYV/2,"했다. 다 가는 대학에 왜 너는 안 가냐고 부모님은 크게 반대하셨지만, 끝내 대학에 가지 않았다. 그렇게 한전 인턴을 하고,개발자로 삼성전자에 들어갔는데, 부모님은 언제 반대하셨냐는 듯 축하해 주셨다. 남들보다 먼저 사회생활에 뛰어든 동생은 누구...",개발자
150,0,"방콕, 물, 나무...글로우서울 유정수 대표 - 익선동에서 시작해 가장 성장하는 공간개발자",남다른디테일,Jun 18. 2023,https://brunch.co.kr/@@3A9H/51,"오래 전 종로의 익선동이 천지개벽을 하고 있다는 소식을 들었다. 인사동과 탑골공원 등 올드해 보이는 이미지가 강했던 익선동이 도대체 어떻게 바뀌고 있다는 것인지, 큰 관심을 두지 않았다. 그런데 어느새 익선동은 서울의 대표적인 핫플레이스가...",개발자
151,0,첫 이직이 커리어의 방향을 결정한다,장단,Jun 18. 2023,https://brunch.co.kr/@@232f/283,데이터 공부를 해보니 개발 공부가 잘 맞는다는 사실을 알게 되어 본격적으로 프로그래밍 공부 시작 4) 작은 스타트업에서개발자로 근무하게 됨 5) 회사가 어려워져 이직 준비를 하게 되었는데 경력신입으로 대기업 합격 6)개발자로 실력을 쌓은 후...,개발자
152,0,23년 2학기 AI대학원 다닐수있을까,연화유심,Jun 18. 2023,https://brunch.co.kr/@@fouH/3,생각했던 초기와 달리 개인적 AI연구역량은 초보에서 이제야 향상된 느낌이나 매출은 여전히 제자리걸음이고 팀장/시니어개발자님들을 찾아야 할 때가 넘어간 것이다. 벤처기업들에겐 7년이 고비가 되는 것이 기술연구개발이 중심이 된 기업들인 경우...,개발자
153,0,시작에 앞서,소소,Jun 18. 2023,https://brunch.co.kr/@@8g3H/16,내 성취를 알 수 있기 때문이다. 소위 명문대 학부 졸업 후 유학을 했고 요즘 한창 임금 인플레를 불러일으키는 직종인SoftwareEngineer이며 남들이 부럽다 하는 대기업에 입사하여 회사에 다니는 동안 상위 고과를 받고 남보다 조금 빠른 승진을 했는데...,소프트웨어
154,0,"449) 브랜드의 지속가능함, 로컬에서 찾다 - 롱블랙 6월 17일, 문장채집 no. 449",백영선 플라잉웨일 대표,Jun 18. 2023,https://brunch.co.kr/@@AI7/1453,"파머스 마켓' '크리스마스 일루미네이션' 등 다양한 행사 기획. 김성준 시몬스 부사장은 ""공간이 죽지 않으려면, 계속해서소프트웨어업데이트가 이뤄져야 한다""고. 시몬스는 경기 이천의 시몬스 테라스에서 2018년 이후 꾸준히 지역 농특산물 직거래...",소프트웨어
155,0,"스프린트, 기획, 리뷰 - 2023년 24주 차 회고",기획하는 족제비,Jun 18. 2023,https://brunch.co.kr/@@cX6v/37,부채 #기술부채 개발 산출물을 볼 때 ‘기술부채(Technical Debt)’에 대한 얘기를 나누곤 한다. 개발자들에게 기술부채란소프트웨어개발 과정에서 발생하는 여러 결정들로 인해 장기적으로 시스템이 복잡해지고 유지보수가 어려워지는 현상을 말한다...,소프트웨어
