index,used,title,author,publish_time,href,context,search
156,0,예상하는 몸,불비,Jun 18. 2023,https://brunch.co.kr/@@eHU6/216,연구자들은 최근 19세기 독일 물리학자이자 내과의사인 헤르만 폰 헬름홀츠(Hermann von Helmholtz)의 제안을 받아들여 예측코딩(prediction coding)이라고 새로운 이론을 만들었다. 예측코딩은 들어오는 감각 신호를 기반으로 예측을 하고 그러한 예측...,코딩
157,0,모든 시도는 겸손이 아닌 자기 긍정에서 시작한다 - 완벽하지 않아도 할 수 있는 이유,플래터,Jun 17. 2023,https://brunch.co.kr/@@3lvL/178,"이전 직장에서 함께 일하던 유능한개발자분과 티타임을 하다, 나의 강의나 멘토링 활동에 대해 이야기했다. 그러자 돌아온 질문. ""틀릴 수도 있는데, 주저하게 되거나 부끄럽진 않으세요 혹시? 저는 그럴까 봐 못하겠더라고요."" 나는 알게 된 정보나...",개발자
158,0,코치님은 코칭이랑 참 잘 맞네요. - 버디코칭의 즐거움,오소영,Jun 17. 2023,https://brunch.co.kr/@@Oyc/411,"오프라인 일정을 미루거나 연기했는데, 지난주 개강한 FFUM(Find & Fun the Unique Me) 19기 과정은 미루지 않았다.개발자이신 MCC 영코치님의 오랜만의 직강이라 신청했기에 미루고 싶지 않았던 이유도 있고, 요즘 나에게 다시 자기이해/인식으로 연결...",개발자
159,0,"일어나서, 다시 걷기 - 취업 실패 후 3개월 간의 치열한 기록",Wave on the Blue,Jun 17. 2023,https://brunch.co.kr/@@eY2L/3,"취준 끝에 겨우 들어간 회사에서 2주 만에 도망쳐 나온 뒤, 처음으로 '꿈'이 없는 순간이 와버렸다. 오랜 시간 해온 음악도,개발자도, 데이터 분석가도 이젠 내 꿈이 아니었다. 갓 결혼한 나는 누구보다도 직장이 필요한데, 마음이 착잡했다. 사실 그...",개발자
160,0,"다가오는 새로운 시대 그대들은 어떻게 살 것인가? - 메타버스, 생성형 AI 그 이상을 넘어",박샤넬로,Jun 17. 2023,https://brunch.co.kr/@@bhYg/188,"섹션, 업계분들을 만나 뵙고 얻게 된 인사이트와 메시지를 4가지로 압축하여 전달해보려고 한다. 단순히, '개발'만 하는개발자시대의 종말 코로나 팬데믹 시대만 하더라도 많은개발자들이 소위 '억대' 연봉을 요청하였으며, IT업계는 울며 겨자 먹기로...",개발자
161,0,AI와 블록체인이 만날 수 있는 4가지 교차로,delight,Jun 17. 2023,https://brunch.co.kr/@@ZVA/586,"에어비앤비""와 같은 새로운 시장이 등장했다. 이를 통해 개인과 조직들은 사용하지 않는 GPU 리소스를 대여해 AI 연구자 및개발자수요를 맞춰줄 수 있다. 이는 시장 역사상 정말 특별한 순간이다. ChatGPT가 출시되기 전 이미 GPU 공급은 부족했다. 그...",개발자
162,0,"레밍스와 80,90년대 게임에 대한 추억 - 일상을리뷰",Vintage appMaker,Jun 17. 2023,https://brunch.co.kr/@@4WjL/222,"게임하는 동생이 대견했었던 것 같다. 일단, 게임만 있다면 열심히 하는 80년대 청소년이었다. 그리고 게임이 좋아 27년째개발자를 하고 있다. 내 인성과 도덕성을 성립시킨 게임이다. [그레이트 스테지언 어비스]에서 최종 악을 무찌르러 가기 전에...",개발자
163,0,"빠른 속도, 좋기만 한 것은 아닙니다. - 운영과 프로젝트는 속도를 다르게 인식해야 합니다.",김병호,Jun 17. 2023,https://brunch.co.kr/@@YhJ/191,"위한 노력이 오히려 개발을 지연시킵니다. 프로젝트 팀원의 자존심을 떨어뜨립니다. 완성도 낮은 코드를 개발하고 싶은개발자는 없습니다. 시간이 부족하고, 무리한 일정준수(또는 단축)를 요구하는 분위기 때문에 개발 완성도가 낮아도 완료했다고 보고...",개발자
164,0,기분이 확 나빠져서 씁니다.,서필백,Jun 17. 2023,https://brunch.co.kr/@@ei0T/27,분명한 문제행동입니다. 나는 게임이 정말 좋고 게임 장르가 더 잘됐으면 좋겠습니다. 요즘 많이 병들었잖아요. 그런데 그게개발자나 CEO 같은 일부 주요인사들만 문제인 건 아니에요. 유튜버부터 커뮤니티에 글쓰는 사람들까지 평범한 이들도 다 같이...,개발자
165,0,자신의 거짓을 사랑하는 법 - 책 우리가 인생이라 부르는 것들을 읽고서.,윤담,Jun 17. 2023,https://brunch.co.kr/@@6EeA/197,"싶은 '소설'의 영역보다도 더 멀리에 놓여 있었다. 고등학교 이과생을 지나 공대생, 그리고 늘 노트북 모니터와 씨름했던개발자직장생활까지 모두 더하면 20년도 훌쩍 넘는 시간이 나에게 있었다. 그 시간만큼 나는 역사, 인문학, 문학과 거리가 멀었다...",개발자
166,0,"사운드의 시각화, E-클래스의 능력 - [더 뉴 E-클래스 인테리어 - 3편]",모빌리티그라운드,Jun 17. 2023,https://brunch.co.kr/@@9D2m/1150,메르세데스-벤츠가 자체 개발한 이 기능은 액티브 앰비언트 라이팅(Active Ambient Lighting)과 함께 사용할 수 있다.소프트웨어는 주파수(저음/중음/고음) 및 방향(오른쪽/왼쪽)의 매개변수를 기반으로 사운드 신호를 분석한다. 시각적 표현은 비트...,소프트웨어
167,0,"2023년 글로벌 스타트업 생태계 보고서 읽기 - 스타트업 지놈(Startup Genome), GSER 2023 발간",진형석 Innovation Evangelist,Jun 17. 2023,https://brunch.co.kr/@@67oD/19,기간 중 10명 이상 팔로어 보유 Github 코딩인력 숫자 + (10%) 2022년 기준 영어 숙련도 수준 * (10%) 비용(Cost) - (50%)소프트웨어기술인력 급여 수준(낮을수록 좋다고 간주) + (50%) 펀딩 런웨이 - 조사기간 중 Series A 투자금 중간값 대비...,소프트웨어
168,0,"환골탈태한 국민차, 쏘나타 디 엣지 출시",KB차차차 장기렌터카,Jun 17. 2023,https://brunch.co.kr/@@cPfQ/171,"그 외 1열 열선 시트와 운전석 전동 시트, 스마트키, 전동식 파킹 브레이크, 전 좌석 세이프티 파워 윈도우, 무선소프트웨어업데이트, 전방 충돌 방지 보조, 차로 유지 보조, 차로 이탈 방지 보조, 운전자 주의 경고, 하이빔 보조, 전방 차량 출발 알림...",소프트웨어
169,0,16. 인공지능 활용 콘텐츠 제작 실습,N잡러,Jun 17. 2023,https://brunch.co.kr/@@70aR/205,이겼을 때 한국은 충격을 받았다. 이제 로봇이 인간의 직업을 대신하게 되어 일자리를 잃게 되었다고 말이다. 그리곤코딩을 배워야 한다며 유치원생들에게도 교육을 했다. 키오스크가 보편이 되고 식당에서 서빙로봇을 봐도 신기하지 않게 되었다. 우리...,코딩
170,0,신뢰라는 무형의 자산에 대하여 - 신뢰 자산이 축적되고 무너지는 과정,일찌,Jun 16. 2023,https://brunch.co.kr/@@8GwY/113,"끝났다. 내일은 최후의 만찬이다. 우리 팀은 2년동안 서로를 '믿으며' 일을 해왔다. 나와 대표는 개발을 모르니개발자들의 말을 믿었고,개발자들은 경영/마케팅을 모르니 우리를 응원하며 자신의 일에 몰두했다. 하지만 끝이 성공보단 실패에 가깝다보니...",개발자
171,0,Chat GPT 3일 만에 창업하고 OOO만원 계약직전 - 크리에이터 통합 플랫폼 : Trilllon,삼태현,Jun 16. 2023,https://brunch.co.kr/@@d191/86,"심각도 순위 1,2위인 선호도 분석, 피드백 수집은 3일이라는 제약 안에 완성할 수 없는 프로젝트라 판단했습니다. 추후에개발자와 협력하여 프로젝트를 진행해 보겠지만 이번 프로젝트에선 현실적인 여건으로 3위인 여러 플랫폼에서 콘텐츠 공유 문제를...",개발자
172,0,[에세이] 내 일하며 잘 살기 (1) - 직장과 헤어질 결심,박시형,Jun 16. 2023,https://brunch.co.kr/@@a1cc/158,"아마 명문대를 졸업한 대기업 출신 퇴사자라고 하더라도 그 자체만으로는 눈길을 끌지 못할 것이다. MIT를 졸업한 애플개발자가 퇴사했다면 이야기가 좀 달라지겠지만. 대신 사람들의 관심사는 '퇴사'에서 한 걸음 더 나아가, 퇴사 이후의 삶에 대해 궁금...",개발자
173,0,"데이터를 읽는 능력이, 내 세상의 한계다 - 데이터 리터러시와 AI 리터러시",이노핏파트너스 innoFIT Partners,Jun 16. 2023,https://brunch.co.kr/@@9xP4/250,필요 인력의 차이를 나타내는 인력 부족률은 12.2%로 나타났습니다. 분야별로는 △데이터 과학자 △데이터 분석가 △데이터개발자등이 필요 직무로 손꼽혔습니다. 이같은 상황에도 데이터 기본법에 대한 기대가 커지고 있습니다. 데이터 기본법은 데이터...,개발자
174,0,오토레이아웃의 시작 (feat. Apple),스무,Jun 16. 2023,https://brunch.co.kr/@@axQG/11,가지고 출시가 되었어요. 아이폰 시리즈 최초로 기기간 사이즈가 달라지게 된 것이죠. 이렇게 스크린의 크기가 커지면서개발자들은 기존의 화면에서 동작하던 앱들이 4인치 화면에서도 동일하게 동작할 수 있는 솔루션이 필요했는데 그것이 바로 애플의...,개발자
175,0,[IT 뉴스레터] 애플 '비전 프로' 출시 - 6월 3주 차 - 애플 혼합현실 헤드셋 '비전 프로' 출시,하이퍼클라우드,Jun 16. 2023,https://brunch.co.kr/@@eJme/63,"찾아뵐게요! 하이퍼클라우드 뉴스레터는 1,3주 금요일 발행됩니다. 지난 IT 뉴스 트렌드 살펴보기 >> ► [6월 1주 차] 토스개발자컨퍼런스 ‘SLASH 2023’ 개최 ► [5월 3주차] 드디어 나왔어요. 카카오톡, 조용히 나가기 기능 추가 다른 흥미로운 콘텐츠...",개발자
176,0,[외신] 대기업을 보면 스타트업의 미래를 알 수 있다.,Mobiinside,Jun 16. 2023,https://brunch.co.kr/@@zIH/5313,"가는 선을 그릴 수 있다: 큰 흐름에 자신을 맞출 수 있는가? 우리가 간과하고 있는 것은 없는가? 이번 주 애플의 글로벌개발자회의 WWDC에서 애플은 AR/VR 헤드셋을 공개했다. 가격은 3,500달러로 상업적 성공을 거두지는 못하겠지만, 스타트업 기업...",개발자
177,0,[도서 리뷰]개발자원칙 - 이 좋은 걸개발자만 읽고 있었네,감자빵,Jun 16. 2023,https://brunch.co.kr/@@5sgh/20,"개발자원칙 (2022.012. | 골든래빗 | 박성철 외 8명 공저 | 22,000원) 철저히 제목에 속아버렸다. 현업에 당장 쓸 만한 ‘클린 코드’나개발자로서 스펙을 증진시키는 꿀팁을 다루는 줄 알았던 이 책은개발자를 위한 기술서가 아니라개발자라는 직업을...",개발자
178,0,온보딩 경험을 개인화하는 4가지 방법,루피,Jun 16. 2023,https://brunch.co.kr/@@feyX/63,"매출 증가 : 애플리케이션은 개인화된 추천 및 제안을 생성하여 사용자가 구매하도록 장려할 수 있으며, 이는 애플리케이션개발자또는 회사의 매출을 증가시킵니다. 설득력 있는 사용자 통찰력 : 개인화를 위해서는 사용자 선호도와 행동에 대한 정보를...",개발자
179,0,15년 전 만든 어드민페이지 스토리보드를 보며 - 대학생 때의 패기,조샘물,Jun 16. 2023,https://brunch.co.kr/@@lfR/24,"스킵 12페이지로 점프 24페이지로 마무리 당시 이 투박하고 무질서한 29페이지의 ppt 문서를 인쇄하고, 해당 기업의개발자분과 이 문서로 미팅하며 이 정도는 충분히 구현 가능하다는 답변을 받았던게 기억난다. 하지만 결국 이 기업으로의 서비스 양도는...",개발자
180,0,하드코어한 엔지니어링 문화 - On Entrepreneurship and Business | 기업가정신,김박사의 이노베이션 연구소,Jun 16. 2023,https://brunch.co.kr/@@3Ta2/839,"엔지니어링 중심의 운영 수준을 높이기 위해 머스크는 또한 테슬라에서 엔지니어를 파견했는데, 이는 트위터에서 근무하는소프트웨어엔지니어링 직원을 평가하고 핵심인재를 파악하기 위한 것이었다. 그의 엔지니어링 중심의 트위터 운영에 대한 생각은...",소프트웨어
181,0,"칩워, 복잡하고도 미묘한 각국 이해관계의 방정식",delight,Jun 16. 2023,https://brunch.co.kr/@@ZVA/585,그때 미국은 앤디 그로브를 부활시켜야할 필요성을 절감하고 있었다. 반도체 산업에서 미국은 여전히 선망의 대상이었다.소프트웨어에서 기계 장치까지 반도체 산업의 수많은 병목을 지배하고 있었고 그 지위는 날로 굳건해지고 있었다. 엔비디아 같은...,소프트웨어
182,0,"""무려 773만 원 인상?"" 신형 싼타페 예상 가격은?",Torque,Jun 16. 2023,https://brunch.co.kr/@@eLI2/392,"확인됐다. (사진=하이테크로 SNS) 여기에 디지털 키 2와 빌트인 캠 2, 에르고 모션 시트, 실내 지문 인증 시스템, 무선소프트웨어업데이트(OTA) 등의 신규 적용을 예상해 볼 수 있다. 일부 기능들은 그랜저 뿐 아니라 쏘나타에도 적용했던 만큼, 싼타페...",소프트웨어
183,0,"""진짜 역대급 고민"" 신형 싼타페 vs 신형 쏘렌토",Torque,Jun 16. 2023,https://brunch.co.kr/@@eLI2/388,"두 차량의 안전 및 편의사양은? ㅡ 싼타페는 디지털 키 2와 빌트인 캠 2, 에르고 모션 시트, 실내 지문 인증 시스템, 무선소프트웨어업데이트(OTA) 등의 신규 적용을 예상해볼 수 있다. 일부 기능들은 그랜저 뿐 아니라 쏘나타에도 적용했던 만큼...",소프트웨어
184,0,토요일 새벽 6시 퇴근 회고 - 팀원이 언제 퇴근했는지? 모르는 팀장,악어,Jun 16. 2023,https://brunch.co.kr/@@1WCq/260,"해당 수정 요청을 마무리 지었구요! 퇴근 하기 전, 그분께서 저의 프로젝트 '폴더 정리 방식'과 업무 중 뛰워져 있는 여러소프트웨어들의 '윈도우 창 배치 방식'에 대해 지적하고 지랄맞은 조언을 해주셨지만요! 그 날, 팀장의 메시지가 여러번 도착...",소프트웨어
185,0,장수하는 IP는 무엇이 다를까 - 우리 IP의 흥망성쇠 : 3편 장수하는 IP 특성 살펴보기,스토리플레이어,Jun 16. 2023,https://brunch.co.kr/@@9D16/27,2020년을 끝으로 어도비 플래시가 서비스를 종료하며 더이상 웹브라우저에서 즐길 수 없게 되었습니다. 이처럼 특정소프트웨어로만 구현이 가능하거나 제한적인 디바이스에서만 즐길 수 있는 콘텐츠는 해당소프트웨어나 디바이스에 의해 수명이 결정되어...,소프트웨어
186,0,9. 비즈니스 모델 실습 - 당신의 아이디어가 비즈니스가 되는 순간,강코치,Jun 16. 2023,https://brunch.co.kr/@@ABO/301,"간에서 무엇을 제공하며 무엇을 받는지를 표현한 것입니다. 거래라는 쌍방향의 관계라 할 수 있습니다. 판매모델은 자사가소프트웨어를 개발하여 판매 채널을 통해 판매하되, 사용자에게 소유권 및 사용권이 부여되는 모델입니다. PC에 설치되는...",소프트웨어
187,0,6. 아이디어 구체화하기 - 당신의 아이디어가 비즈니스가 되는 순간,강코치,Jun 15. 2023,https://brunch.co.kr/@@ABO/297,"PO(Product Owner), 앱 기획자, 웹 기획자, 앱 디자이너, 웹 디자이너, 퍼블리셔, 네이티브 앱 개발자, 프런트엔드 개발자,백엔드개발자, DB 개발자, 아키텍처, 품질(QA) 담당자 등으로 구성이 됩니다. 이렇게 많은 팀원이 구성될 때는 우리가 어떤...",백엔드
188,0,사회초년생이 알면 좋은 꿀팁 5가지 - UI UX 신입 디자이너라면 알아둬야할 업계 전문 용어,다채로운 윤슬,Jun 15. 2023,https://brunch.co.kr/@@5uKL/48,흐름으로 진행되는지 한 눈에 볼 수 있는 자료 프론트엔드 Front-end 시각적으로 보여지는 화면을 코딩하는 개발 영역백엔드Back-end 데이터 값이 흘러가는 구조를 설계하는 개발 영역으로 실질적으로 보이지 않는 부분을 담당한다 풀스택 개발자 Full...,백엔드
